{
  "campaign_id": "camp_locos_materos_2026",
  "composition_id": "LocosMaterosCommercial",
  "format": {
    "width": 720,
    "height": 1280,
    "fps": 24.0,
    "duration_in_frames": 700,
    "duration_seconds": 29.167
  },
  "brand_meta": {
    "name": "Locos Materos",
    "claim": "¿Dónde estás tú? Está tu mate.",
    "primary_color": "#0D5C3A",
    "accent_color": "#D4AF37",
    "cta_url": "www.locosmateros.cl",
    "logo_path": "Recursos/Imeges/WhatsApp Image 2026-09-16 at 10.21.14 PM.jpeg"
  },
  "audio_track": {
    "src": "Recursos/Audios/Entre_mates_y_sol.mp3",
    "bpm": 107.7,
    "duration_seconds": 29.187
  },
  "scenes": [
    {
      "scene_id": "scene_01",
      "start_frame": 0,
      "duration_frames": 84,
      "video_src": "Recursos/videos/scene_01.mp4",
      "text_overlay": "Cada día comienza con una pausa.",
      "style": "slide_up_reveal"
    },
    {
      "scene_id": "scene_02",
      "start_frame": 84,
      "duration_frames": 79,
      "video_src": "Recursos/videos/scene_02.mp4",
      "text_overlay": "El arte de prepararse para lo bueno.",
      "style": "slide_up_reveal"
    },
    {
      "scene_id": "scene_03",
      "start_frame": 163,
      "duration_frames": 82,
      "video_src": "Recursos/videos/scene_03.mp4",
      "text_overlay": "Un país que despierta con la cordillera.",
      "style": "slide_up_reveal"
    },
    {
      "scene_id": "scene_04",
      "start_frame": 245,
      "duration_frames": 79,
      "video_src": "Recursos/videos/scene_04.mp4",
      "text_overlay": "La energía de arrancar juntos.",
      "style": "slide_up_reveal"
    },
    {
      "scene_id": "scene_05",
      "start_frame": 324,
      "duration_frames": 79,
      "video_src": "Recursos/videos/scene_05.mp4",
      "text_overlay": "En cada esquina, en cada paso.",
      "style": "slide_up_reveal"
    },
    {
      "scene_id": "scene_06",
      "start_frame": 403,
      "duration_frames": 77,
      "video_src": "Recursos/videos/scene_06.mp4",
      "text_overlay": "El mate que acompaña tu esfuerzo.",
      "style": "slide_up_reveal"
    },
    {
      "scene_id": "scene_07",
      "start_frame": 480,
      "duration_frames": 77,
      "video_src": "Recursos/videos/scene_07.mp4",
      "text_overlay": "Ideas que se comparten mejor.",
      "style": "slide_up_reveal"
    },
    {
      "scene_id": "scene_08",
      "start_frame": 557,
      "duration_frames": 67,
      "video_src": "Recursos/videos/scene_08.mp4",
      "text_overlay": "Un sabor que nos vuelve a reunir.",
      "style": "slide_up_reveal"
    },
    {
      "scene_id": "scene_09",
      "start_frame": 624,
      "duration_frames": 76,
      "video_src": "Recursos/videos/scene_09.mp4",
      "text_overlay": "¿Dónde estás tú? Está tu mate.",
      "style": "slide_up_reveal"
    }
  ],
  "variants": [
    {
      "variant_id": "master_30s_emocional",
      "name": "Master 30s Emocional",
      "target_audience": "Público general adulto (20-50 años), amantes de las pausas cotidianas",
      "props_override": {
        "tone": "emocional",
        "emphasis": "calidez y ritual"
      },
      "output_file": "campaign/remotion/renders/commercial_30s_emocional.mp4"
    },
    {
      "variant_id": "variant_publicitaria",
      "name": "Variante Comercial de Conversión",
      "target_audience": "Compradores en línea y prospectos de e-commerce mate",
      "props_override": {
        "tone": "publicitaria",
        "cta_url": "www.locosmateros.cl/ofertas",
        "scene_01_text": "Empezá tus mañanas con Locos Materos."
      },
      "output_file": "campaign/remotion/renders/commercial_30s_publicitaria.mp4"
    },
    {
      "variant_id": "variant_conversacional",
      "name": "Variante Cercana / Redes Sociales",
      "target_audience": "Jóvenes y usuarios activos en TikTok / Reels",
      "props_override": {
        "tone": "conversacional",
        "scene_01_text": "Suena el agua y parte el día."
      },
      "output_file": "campaign/remotion/renders/commercial_30s_conversacional.mp4"
    },
    {
      "variant_id": "bumper_15s",
      "name": "Bumper 15s Pre-roll",
      "target_audience": "Audiencias móviles con alta rotación en YouTube pre-roll",
      "props_override": {
        "duration_in_frames": 360,
        "scenes_subset": [
          "scene_01",
          "scene_05",
          "scene_08",
          "scene_09"
        ]
      },
      "output_file": "campaign/remotion/renders/bumper_15s.mp4"
    }
  ]
}